{
  "schema_version": "damage_curve_record_bundle.v3",
  "schema_status": "released",
  "cell_id": "tropical_cyclone_wind_wind",
  "damage_code_id": "TROPICAL_CYCLONE_WIND_WIND_JAIMES_SCREENING_V1",
  "semantic_damage_model_version": "model v1.0",
  "documentation_revision": "docs r1",
  "lifecycle_state": "released_v1_0",
  "promotion_status": "released",
  "review_status": "reviewed_partial_screening_release",
  "model_grade": "screening_source_derived_engineering_proxy",
  "package_release": "unreleased",
  "package_baseline": "library v2.5",
  "package_inclusion_status": "repository_canonical_not_in_portable_package",
  "canonical_runtime_artifact": true,
  "source_dossier": "docs/cells/tropical_cyclone_wind_wind/current/tropical_cyclone_wind_wind_curve_derivation_dossier__model_v1_0__docs_r1.md",
  "source_workbook": "docs/cells/tropical_cyclone_wind_wind/current/damage_curve_records_tropical_cyclone_wind_wind__model_v1_0__docs_r1.xlsx",
  "known_answer_tests": "docs/cells/tropical_cyclone_wind_wind/current/known_answer_tests_tropical_cyclone_wind_wind__model_v1_0__docs_r1.json",
  "source_register": "docs/cells/tropical_cyclone_wind_wind/current/SOURCE_REGISTER_tropical_cyclone_wind_wind__model_v1_0__docs_r1.csv",
  "claim_parameter_register": "docs/cells/tropical_cyclone_wind_wind/current/CLAIM_PARAMETER_REGISTER_tropical_cyclone_wind_wind__model_v1_0__docs_r1.csv",
  "value_crosswalk": "docs/cells/tropical_cyclone_wind_wind/current/VALUE_CROSSWALK_tropical_cyclone_wind_wind__model_v1_0__docs_r1.csv",
  "failure_units": [
    {
      "id": "WT_JAIMES_TURBINE_TOWER_EXPOSURE_UNIT",
      "subsystem": "REPEATED_TURBINE_SOURCE_NATIVE",
      "component": "TOWER_TRIGGERED_SINGLE_TURBINE_RECORD_JAIMES",
      "treatment": "primary_nonzero",
      "y_axis": "failure_unit_damage_ratio",
      "denominator": "Jaimes paper-defined per-turbine/turbine-tower replacement-cost proxy Ct(h); not CWER tower, standard turbine-equipment assembly, BOS, physical plant, or TIV",
      "exposure_grain": "one modeled turbine point",
      "mutually_exclusive_with": [
        "WT_TURBINE_EQUIPMENT_ASSEMBLY"
      ]
    },
    {
      "id": "WT_TURBINE_EQUIPMENT_ASSEMBLY",
      "subsystem": "REPEATED_TURBINE",
      "component": "ROTOR_NACELLE_TOWER_DEPENDENCY_SAFE_ASSEMBLY",
      "treatment": "withheld",
      "y_axis": "failure_unit_damage_ratio",
      "denominator": "same-unit turbine-equipment replacement value",
      "withheld_reason_codes": [
        "SOURCE_NATIVE_ATOM_NOT_HARMONIZED_TO_STANDARD_EQUIPMENT_ASSEMBLY",
        "OMITTED_NON_TOWER_FAILURE_MODES"
      ]
    },
    {
      "id": "WT_FOUNDATION",
      "subsystem": "FOUNDATION",
      "component": "TURBINE_FOUNDATION_OR_BASE",
      "treatment": "withheld",
      "y_axis": "failure_unit_damage_ratio",
      "denominator": "same-unit foundation replacement value",
      "withheld_reason_codes": [
        "NO_RUNTIME_CURVE_FOR_PATHWAY_UNIT"
      ]
    },
    {
      "id": "WT_PAD_MOUNTED_ELECTRICAL",
      "subsystem": "PLANT_ELECTRICAL",
      "component": "PAD_TRANSFORMER_AND_SWITCHGEAR",
      "treatment": "withheld",
      "y_axis": "failure_unit_damage_ratio",
      "denominator": "same-unit pad-electrical replacement value",
      "withheld_reason_codes": [
        "NO_RUNTIME_CURVE_FOR_PATHWAY_UNIT",
        "ELECTRICAL_VALUE_SPLIT_REQUIRED"
      ]
    },
    {
      "id": "WT_COLLECTION_SYSTEM",
      "subsystem": "PLANT_ELECTRICAL",
      "component": "COLLECTION_CABLE_AND_POLES",
      "treatment": "withheld",
      "y_axis": "failure_unit_damage_ratio",
      "denominator": "same-unit line/network replacement value",
      "withheld_reason_codes": [
        "NO_RUNTIME_CURVE_FOR_PATHWAY_UNIT",
        "LINE_NETWORK_EXPOSURE_REQUIRED"
      ]
    },
    {
      "id": "WT_GSU_SUBSTATION",
      "subsystem": "SUBSTATION",
      "component": "GSU_TRANSFORMER_SWITCHYARD_AND_CONTROL",
      "treatment": "withheld",
      "y_axis": "failure_unit_damage_ratio",
      "denominator": "same facility-level GSU/substation replacement value",
      "withheld_reason_codes": [
        "NO_RUNTIME_CURVE_FOR_PATHWAY_UNIT",
        "FACILITY_LEVEL_EXPOSURE_REQUIRED"
      ]
    },
    {
      "id": "WT_CONTROL_BUILDING_AND_SCADA",
      "subsystem": "CONTROL",
      "component": "CONTROL_BUILDING_SCADA_AND_COMMUNICATIONS",
      "treatment": "withheld",
      "y_axis": "failure_unit_damage_ratio",
      "denominator": "same-unit control and communications replacement value",
      "withheld_reason_codes": [
        "NO_RUNTIME_CURVE_FOR_PATHWAY_UNIT"
      ]
    },
    {
      "id": "WT_CIVIL_INFRA",
      "subsystem": "PLANT_CIVIL",
      "component": "ACCESS_ROADS_CRANE_PADS_BUILDINGS_AND_FENCES",
      "treatment": "withheld",
      "y_axis": "failure_unit_damage_ratio",
      "denominator": "split direct civil replacement value",
      "withheld_reason_codes": [
        "NO_RUNTIME_CURVE_FOR_PATHWAY_UNIT",
        "MIXED_CIVIL_BUCKET_REQUIRES_SPLIT"
      ]
    },
    {
      "id": "SUPPORT_FIELDWORK",
      "subsystem": "SUPPORT",
      "component": "ASSEMBLY_INSTALLATION_AND_CRANE_SCOPE",
      "treatment": "withheld",
      "y_axis": "not_applicable_support_cost",
      "denominator": "post-damage repair work scope",
      "withheld_reason_codes": [
        "SUPPORT_COST_ALLOCATE_ONCE_AFTER_DISPOSITION",
        "NO_INDEPENDENT_FRAGILITY"
      ]
    },
    {
      "id": "SUPPORT_TRANSPORT_LOGISTICS",
      "subsystem": "SUPPORT",
      "component": "TRANSPORT_AND_REPLACEMENT_LOGISTICS",
      "treatment": "withheld",
      "y_axis": "not_applicable_support_cost",
      "denominator": "post-damage replacement logistics scope",
      "withheld_reason_codes": [
        "SUPPORT_COST_ALLOCATE_ONCE_AFTER_DISPOSITION",
        "NO_INDEPENDENT_FRAGILITY"
      ]
    }
  ],
  "pathways": [
    {
      "pathway_id": "tropical_cyclone_wind",
      "hazard_scope": {
        "included": [
          "direct aerodynamic loading from tropical-cyclone wind on land-based turbine records"
        ],
        "excluded": [
          "TC-spawned tornado",
          "windborne debris impact",
          "wind-driven rain ingress",
          "storm surge",
          "pluvial flood",
          "scour or saturated-soil failure",
          "lightning or fire",
          "offshore wave and support loading",
          "business interruption or curtailment"
        ],
        "compound_event_rule": "Preserve one event_family_id and route each causal pathway separately without duplicate value charges."
      },
      "hazard_axis": {
        "id": "TC_PEAK_GUST_3S_10M_KMH_JAIMES",
        "preferred_input_field": "tc_peak_gust_3s_10m_kmh",
        "permitted_proxy_fields": [],
        "unit": "km/h",
        "valid_range": [
          0,
          252
        ],
        "extrapolation_policy": "V<0 reject; V<=90 return source-assumed zero with flag; 90<V<108 withhold; 108<=V<=252 evaluate; V>252 withhold",
        "source_simulation_range": [
          108,
          252
        ],
        "averaging_period_s": 3,
        "reference_height_m": 10,
        "category_guardrail": "Saffir-Simpson category and NHC one-minute sustained wind are not accepted damage inputs.",
        "bridge_policy": "No averaging-period, height, terrain, or hub/rotor bridge is included in model v1.0."
      },
      "selector_logic": [
        {
          "field": "turbine_archetype_id",
          "required": true,
          "default": null,
          "allowed": [
            "TCWW_JAIMES_GENERIC_1MW_HH44_V1",
            "TCWW_JAIMES_GENERIC_2P5MW_HH80_V1",
            "TCWW_JAIMES_GENERIC_3P3MW_HH100_V1"
          ],
          "routing": "exact selector_match only",
          "interpolation": "prohibited",
          "nearest_neighbor": "prohibited",
          "modern_fleet_transfer": "prohibited"
        },
        {
          "field": "source_model_assumption_set_id",
          "required": true,
          "default": null,
          "allowed": [
            "JAIMES_2020_GENERIC_FIXED_BASE_STEEL_PARKED_ROTOR_AS_DOCUMENTED"
          ],
          "effect": "Acknowledges the source-model state; it is not a protective control credit."
        }
      ],
      "conditioner_logic": [
        {
          "field": "actual_operating_control_state",
          "required": "capture_if_known",
          "allowed": [
            "known_consistent_with_source_assumption",
            "known_inconsistent_with_source_assumption",
            "unknown"
          ],
          "numeric_effect": "none",
          "withhold_when": [
            "known_inconsistent_with_source_assumption"
          ],
          "flag_when": [
            "unknown"
          ],
          "reason": "The paper contains feathered/minimum-drag versus parked/no-pitch wording and assumes wind parallel to the rotor with no yawing."
        }
      ],
      "exposure_contract": {
        "required_subject_grain": "one turbine point",
        "whole_farm_default": "prohibited",
        "repeated_turbine_rule": "Evaluate each qualifying turbine separately with its local source-native gust.",
        "gsu_rule": "WT_GSU_SUBSTATION is one facility-level exposure and is never repeated by turbine count.",
        "value_rule": "No dollar loss is emitted until the source-native denominator is independently harmonized."
      },
      "failure_unit_coverage": [
        {
          "failure_unit_id": "WT_JAIMES_TURBINE_TOWER_EXPOSURE_UNIT",
          "status": "conditional_numeric_screening_curve",
          "reason_codes": []
        },
        {
          "failure_unit_id": "WT_TURBINE_EQUIPMENT_ASSEMBLY",
          "status": "withheld_not_zero",
          "reason_codes": [
            "SOURCE_NATIVE_ATOM_NOT_HARMONIZED_TO_STANDARD_EQUIPMENT_ASSEMBLY",
            "OMITTED_NON_TOWER_FAILURE_MODES"
          ]
        },
        {
          "failure_unit_id": "WT_FOUNDATION",
          "status": "withheld_not_zero",
          "reason_codes": [